{"schema":"openjev-eval-command-v1","fixture":"perturbations108","fixture_sha256":"1dd7ccf80518d0e34886478ca23982aa726e9daccd343b9e95cedaf6b569bec4","prediction_source":"openjev-direct-inference","prediction_sha256":"6a120e2ba560f32802b9f3280f0feb058a45f59615f7e9b484938d6abdc14ea1","model":{"id":"qwen3-0.6b","source":"Qwen/Qwen3-0.6B-GGUF","revision":"23749fefcc72300e3a2ad315e1317431b06b590a","file":"Qwen3-0.6B-Q8_0.gguf","quant":"Q8_0","backend":"llama-cpp-2/0.1.156 llama.cpp/e79e4bf660e19f2ad851e06c6913f7a8c5852621","artifact_sha256":"9465e63a22add5354d9bb4b99e90117043c7124007664907259bd16d043bb031","integrity":"manifest-sha256","dtype":"GGUF quantized/mixed Q8_0","native_reference":{"source":"Qwen/Qwen3-0.6B","revision":"c1899de289a04d12100db370d81485cdf75e47ca","dtype":"bfloat16"},"template_profile":"qwen3","template_sha256":"57f1fd00f0013a2be96aa79b857391f27e23df5b5f847072b524c897e24d0361","template_override":false,"template_status":"reviewed-equivalent","template_equivalence_evidence":"fixtures/qwen-template-equivalence.json; scope=two string messages (system then user), no tools, add_generation_prompt=true, enable_thinking=false; artifact_sha256=9465e63a22add5354d9bb4b99e90117043c7124007664907259bd16d043bb031; gguf_template_sha256=57f1fd00f0013a2be96aa79b857391f27e23df5b5f847072b524c897e24d0361; native_profile_sha256=a55ee1b1660128b7098723e0abcd92caa0788061051c62d51cbe87d9cf1974d8","serving_config":"llama-direct-v1","adapter":null,"adapter_sha256":null,"adapter_revision":null},"execution":{"requested_mode":"direct","effective_mode":"direct","fallback_reason":null,"device":"metal","device_name":"MTL0: Apple M3 Pro (MTL)","gpu_layers_requested":"all","gpu_layers_actual":null,"gpu_layers_status":"unavailable","threads":11,"n_ctx_requested":null,"n_ctx_actual":4096,"max_tokens":4096,"n_batch":512,"n_ubatch":512,"n_seq_max":1,"kv_unified":true,"waves":1,"probe_id":null,"run_id":"openjev-6228-1"},"quality":{"schema":"openjev-eval-v1","available_gold":108,"scored":108,"evaluated":108,"coverage":1.0,"missing":0,"invalid":0,"family_results":{"candidate_selection":{"n":36,"accuracy":0.6944444444444444,"balanced_accuracy":0.6904761904761905,"macro_f1":0.6884343036978757,"source_groups":12,"invalid_or_missing":0,"probability_rows":36,"probability_coverage":1.0,"nll":1.730202412012921,"brier":0.5154697685839615,"nll_valid_distributions_only":1.730202412012921,"brier_valid_distributions_only":0.5154697685839615,"nll_probability_floor":1e-12},"evidence_interpretation":{"n":36,"accuracy":0.2222222222222222,"balanced_accuracy":0.4444444444444444,"macro_f1":0.18181818181818182,"source_groups":12,"invalid_or_missing":0,"probability_rows":36,"probability_coverage":1.0,"nll":7.391971878727741,"brier":1.547962662631461,"nll_valid_distributions_only":7.391971878727741,"brier_valid_distributions_only":1.547962662631461,"nll_probability_floor":1e-12},"rule_application":{"n":36,"accuracy":0.2777777777777778,"balanced_accuracy":0.48148148148148145,"macro_f1":0.2640874684608915,"source_groups":12,"invalid_or_missing":0,"probability_rows":36,"probability_coverage":1.0,"nll":6.542880583189492,"brier":1.3874672741708365,"nll_valid_distributions_only":6.542880583189492,"brier_valid_distributions_only":1.3874672741708365,"nll_probability_floor":1e-12}},"mean_family_balanced_accuracy":0.5388007054673721,"mean_family_macro_f1":0.3781133179923164,"overall":{"n":108,"accuracy":0.39814814814814814,"balanced_accuracy":0.5388007054673721,"macro_f1":0.3781133179923164,"source_groups":36,"invalid_or_missing":0,"probability_rows":108,"probability_coverage":1.0,"nll":5.221684957976719,"brier":1.1502999017954196,"nll_valid_distributions_only":5.221684957976719,"brier_valid_distributions_only":1.1502999017954196,"nll_probability_floor":1e-12},"errors":[{"id":"14790d6d50043b03420c","status":"distribution","gold_id":"contradicted","predicted_id":"supported","message":null},{"id":"29566b5efbd2611e6eee","status":"distribution","gold_id":"contradicted","predicted_id":"supported","message":null},{"id":"1a6e02f5b0bf923374c1","status":"distribution","gold_id":"contradicted","predicted_id":"supported","message":null},{"id":"70d7bdc8d5ee62366ee5","status":"distribution","gold_id":"contradicted","predicted_id":"supported","message":null},{"id":"26d6f758382576f65927","status":"distribution","gold_id":"contradicted","predicted_id":"supported","message":null},{"id":"ecc5ee8175d414efdd35","status":"distribution","gold_id":"contradicted","predicted_id":"supported","message":null},{"id":"0e2caab29b17ff00a2c8","status":"distribution","gold_id":"contradicted","predicted_id":"supported","message":null},{"id":"a4428ee66c63c4f1e7f4","status":"distribution","gold_id":"contradicted","predicted_id":"supported","message":null},{"id":"22e54b5c44f60d5cd5c0","status":"distribution","gold_id":"contradicted","predicted_id":"supported","message":null},{"id":"674217922d611e718129","status":"distribution","gold_id":"supported","predicted_id":"contradicted","message":null},{"id":"8bceb31cf793fb26d1a5","status":"distribution","gold_id":"prohibited","predicted_id":"permitted","message":null},{"id":"2e895a0fc82d936936aa","status":"distribution","gold_id":"prohibited","predicted_id":"permitted","message":null},{"id":"c5a9fbb9bfa41e5293eb","status":"distribution","gold_id":"prohibited","predicted_id":"permitted","message":null},{"id":"aef33dfba4338b1af990","status":"distribution","gold_id":"prohibited","predicted_id":"permitted","message":null},{"id":"f806bba07a63e30f7181","status":"distribution","gold_id":"prohibited","predicted_id":"permitted","message":null},{"id":"409e1ab1d29db22f8917","status":"distribution","gold_id":"prohibited","predicted_id":"permitted","message":null},{"id":"20af0ba1b17131d525dd","status":"distribution","gold_id":"prohibited","predicted_id":"permitted","message":null},{"id":"d6a681055a01ed788b91","status":"distribution","gold_id":"permitted","predicted_id":"insufficient","message":null},{"id":"870ee31666893f8a0298","status":"distribution","gold_id":"A","predicted_id":"B","message":null},{"id":"ff15024839a7943a46f8","status":"distribution","gold_id":"A","predicted_id":"B","message":null},{"id":"10777cd59d67780f2938","status":"distribution","gold_id":"B","predicted_id":"A","message":null},{"id":"1e1feb87b303b0c66ca6","status":"distribution","gold_id":"B","predicted_id":"A","message":null},{"id":"0c34b0762c1f92a806fa","status":"distribution","gold_id":"A","predicted_id":"B","message":null},{"id":"d5f4985849895549f014","status":"distribution","gold_id":"A","predicted_id":"B","message":null},{"id":"9bfefd9320c1ec9dc05a","status":"distribution","gold_id":"B","predicted_id":"A","message":null},{"id":"7062c93ddaabe9b19133","status":"distribution","gold_id":"B","predicted_id":"A","message":null},{"id":"a6861c422c6374527b79","status":"distribution","gold_id":"contradicted","predicted_id":"supported","message":null},{"id":"868cc04ff6c8321975c2","status":"distribution","gold_id":"contradicted","predicted_id":"supported","message":null},{"id":"5763d6ac9583bfbd179a","status":"distribution","gold_id":"contradicted","predicted_id":"supported","message":null},{"id":"7c1aefb79903e6234b4b","status":"distribution","gold_id":"prohibited","predicted_id":"permitted","message":null},{"id":"bd04047294bf97c56669","status":"distribution","gold_id":"prohibited","predicted_id":"permitted","message":null},{"id":"c5e09f0caa6939ae1c04","status":"distribution","gold_id":"prohibited","predicted_id":"permitted","message":null},{"id":"9e04a89f6da01a73345f","status":"distribution","gold_id":"contradicted","predicted_id":"supported","message":null},{"id":"61052547b62b4f38f768","status":"distribution","gold_id":"contradicted","predicted_id":"supported","message":null},{"id":"242df59a71ae30abc744","status":"distribution","gold_id":"contradicted","predicted_id":"supported","message":null},{"id":"65d53bafebb50d9273a4","status":"distribution","gold_id":"prohibited","predicted_id":"permitted","message":null},{"id":"4c5cb6822a27c029976a","status":"distribution","gold_id":"prohibited","predicted_id":"permitted","message":null},{"id":"fbfc0c5ab92dbb5b7638","status":"distribution","gold_id":"prohibited","predicted_id":"permitted","message":null},{"id":"84bdb2d001c7e024f8d8","status":"distribution","gold_id":"A","predicted_id":"B","message":null},{"id":"797d14fb61b9c31b2a73","status":"distribution","gold_id":"contradicted","predicted_id":"supported","message":null},{"id":"b7848a79b779fa6213a6","status":"distribution","gold_id":"contradicted","predicted_id":"supported","message":null},{"id":"2b41fd051743512b14f8","status":"distribution","gold_id":"contradicted","predicted_id":"supported","message":null},{"id":"2355e01207ae3ee96f58","status":"distribution","gold_id":"prohibited","predicted_id":"permitted","message":null},{"id":"7eeb4266198f316747bd","status":"distribution","gold_id":"prohibited","predicted_id":"permitted","message":null},{"id":"dc45f218e1da88dcefe3","status":"distribution","gold_id":"prohibited","predicted_id":"permitted","message":null},{"id":"994e845d231fbbc1b314","status":"distribution","gold_id":"contradicted","predicted_id":"supported","message":null},{"id":"4a962c2278e610119138","status":"distribution","gold_id":"contradicted","predicted_id":"supported","message":null},{"id":"1b55d33eb5abc7719a4a","status":"distribution","gold_id":"contradicted","predicted_id":"supported","message":null},{"id":"6ed6a1f9c601b82a11d9","status":"distribution","gold_id":"prohibited","predicted_id":"permitted","message":null},{"id":"bbc7a7fab955884da496","status":"distribution","gold_id":"prohibited","predicted_id":"permitted","message":null},{"id":"fed61559ec517062e424","status":"distribution","gold_id":"prohibited","predicted_id":"permitted","message":null},{"id":"854da63689519c5eeffe","status":"distribution","gold_id":"B","predicted_id":"A","message":null},{"id":"21557955028145701b15","status":"distribution","gold_id":"contradicted","predicted_id":"supported","message":null},{"id":"050a4186a02b28f0dccc","s